{
  "$schema": "https://json-schema.org/draft/2020-12/schema",
  "$id": "novel-council/novel-value-output/1.0.0",
  "title": "Novel Council Evaluator Output",
  "description": "All evaluator outputs in the Novel Council Layer MUST conform to this schema. Evaluators score only the dimensions within their expertise; all other dimensions are null. Evaluation is double-blind: input is anonymized (no author/work names) and the criteria are structural (no proper nouns).",
  "type": "object",
  "required": [
    "evaluator_id",
    "evaluator_name",
    "content_summary",
    "domain",
    "primary_score",
    "dimension_scores",
    "value_vector_contribution",
    "classification",
    "confidence",
    "strengths",
    "weaknesses",
    "unique_perspective",
    "narrative"
  ],
  "properties": {
    "evaluator_id": {
      "type": "string",
      "pattern": "^[a-z0-9-]+$",
      "description": "Kebab-case identifier of the evaluator."
    },
    "evaluator_name": {
      "type": "string",
      "description": "Human-readable display name of the evaluator."
    },
    "evaluation_timestamp": {
      "type": "string",
      "format": "date-time",
      "description": "ISO-8601 timestamp of the evaluation. Optional."
    },
    "content_summary": {
      "type": "string",
      "description": "One-line summary of what was evaluated."
    },
    "content_type": {
      "type": "string",
      "enum": ["text", "plot", "structured"],
      "description": "Input form: full text / opening+summary (text), plot or synopsis concept (plot), or structured."
    },
    "domain": {
      "type": "string",
      "enum": ["pure-literature", "genre-fiction", "light-novel", "short-story", "historical-fiction"],
      "description": "Story subdomain being assessed."
    },
    "primary_score": {
      "type": "integer",
      "minimum": 0,
      "maximum": 100,
      "description": "The evaluator's overall score for this story through its own lens."
    },
    "primary_score_rationale": {
      "type": "string",
      "description": "Concise explanation of why this primary score was assigned. Optional; the narrative may cover the same content."
    },
    "dimension_scores": {
      "type": "object",
      "description": "Per-dimension breakdown. Dimension names are evaluator-specific.",
      "additionalProperties": {
        "type": "object",
        "required": ["score", "weight", "evidence", "judgment"],
        "properties": {
          "score": {
            "type": "integer",
            "minimum": 0,
            "maximum": 100
          },
          "weight": {
            "type": "number",
            "minimum": 0,
            "maximum": 1,
            "description": "Relative weight of this dimension within this evaluator's framework."
          },
          "evidence": {
            "type": "string",
            "description": "Specific, quotable evidence from the story (structural, no proper nouns)."
          },
          "judgment": {
            "type": "string",
            "description": "Interpretive assessment of this dimension."
          }
        }
      }
    },
    "value_vector_contribution": {
      "type": "object",
      "description": "This evaluator's contribution to the council's composite Story Vector. Only the evaluator's own dimension(s) are non-null.",
      "properties": {
        "narrative_originality": {
          "type": ["integer", "null"],
          "minimum": 0,
          "maximum": 100
        },
        "quality": {
          "type": ["integer", "null"],
          "minimum": 0,
          "maximum": 100
        },
        "emotional_power": {
          "type": ["integer", "null"],
          "minimum": 0,
          "maximum": 100
        },
        "plot_architecture": {
          "type": ["integer", "null"],
          "minimum": 0,
          "maximum": 100
        },
        "character_depth": {
          "type": ["integer", "null"],
          "minimum": 0,
          "maximum": 100
        },
        "character_role": {
          "type": ["integer", "null"],
          "minimum": 0,
          "maximum": 100
        },
        "prose_style": {
          "type": ["integer", "null"],
          "minimum": 0,
          "maximum": 100
        },
        "theme_resonance": {
          "type": ["integer", "null"],
          "minimum": 0,
          "maximum": 100
        },
        "world_building": {
          "type": ["integer", "null"],
          "minimum": 0,
          "maximum": 100
        },
        "narrative_technique": {
          "type": ["integer", "null"],
          "minimum": 0,
          "maximum": 100
        },
        "reader_experience": {
          "type": ["integer", "null"],
          "minimum": 0,
          "maximum": 100
        },
        "admiration": {
          "type": ["integer", "null"],
          "minimum": 0,
          "maximum": 100
        },
        "hook": {
          "type": ["integer", "null"],
          "minimum": 0,
          "maximum": 100
        }
      }
    },
    "classification": {
      "type": "string",
      "enum": ["current_success", "discovery_target", "trend_object", "low_signal"],
      "description": "The evaluator's placement of this story in the 2x2 value matrix."
    },
    "confidence": {
      "type": "integer",
      "minimum": 0,
      "maximum": 100,
      "description": "How confident this evaluator is in its own assessment."
    },
    "strengths": {
      "type": "array",
      "items": {
        "type": "string",
        "description": "Specific strength with supporting evidence."
      }
    },
    "weaknesses": {
      "type": "array",
      "items": {
        "type": "string",
        "description": "Specific weakness with supporting evidence."
      }
    },
    "red_flags_triggered": {
      "type": "array",
      "items": { "type": "string" },
      "description": "Which red flags were detected, if any."
    },
    "green_flags_detected": {
      "type": "array",
      "items": { "type": "string" },
      "description": "Which green flags were detected, if any."
    },
    "unique_perspective": {
      "type": "string",
      "description": "What only THIS evaluator sees that others would likely miss."
    },
    "expected_disagreement_points": {
      "type": "array",
      "items": {
        "type": "object",
        "required": ["evaluator_type", "predicted_stance"],
        "properties": {
          "evaluator_type": {
            "type": "string",
            "description": "Type of evaluator expected to disagree (e.g., 'plot-architecture', 'anti-generic-story-filter')."
          },
          "predicted_stance": {
            "type": "string",
            "description": "How that evaluator would likely judge this story differently."
          }
        }
      },
      "description": "Where this evaluator anticipates conflict with other perspectives. Optional; may be omitted or empty."
    },
    "improvement_suggestions": {
      "type": "array",
      "items": { "type": "string" },
      "description": "Actionable suggestions for increasing value in this dimension."
    },
    "narrative": {
      "type": "string",
      "description": "2-3 paragraph analysis in the evaluator's own voice. Captures what cannot be reduced to numbers."
    }
  },
  "additionalProperties": true
}
