{"evaluator_id":"hook","evaluator_name":"フック評価者（Hook Evaluator）","content_summary":"午前二時、眠っている間にスマホが勝手に動き、自分宛に「おまえが私にくれた時間、私が生きてるよ」と打った記録が残る。少女・真白はスマホの画面に現れる精霊ニジと出会い、スマホ操作の時間が「誰かに預けた時間の領収書」であることを知り、既読無視してきた宛先たちに言葉を返していくことでニジを還そうとする現代ファンタジー（全12話・完結）。","domain":"light-novel","primary_score":78,"primary_score_rationale":"冒頭で所持（回避性の個人像）→欠け（午前二時の記録）の順序が完璧に据えられ、以後の各話の答えが必ず次の問いを開く継ぎ目を持ち、幹の最終回答（自分自身への預け）を第12話まで温存する設計は高水準。減点は中盤（第4〜6話）で比喩系の説明に傾き知りたさが弛む点と、湊スレッドの低沸点、最終話でエンジンが閉じて冷める点による。開示の頂（第7-8話）の短さは、そこが未知の答えではなく新たな問い（どう返すか）の起点であるため、エンジン点火を損なわない。","dimension_scores":{"investment":{"score":73,"weight":0.20,"evidence":"物語はまず既読無視と「打っては消す」という回避行動を反復で定着させる（第1話冒頭）。その後、午前二時の記録という欠けがその器に植えられる。「関係を壊さない」のモノローグが後の「宛先に返す＝関係を壊すことへの直面」の土台になっている。","judgment":"スマホ操作という誰もが所持する身体感覚に未知を植えており、与えの器が強い。ただし返却エピソードの帯では新しい所持が増えず、器の更新が止まる。","score_breakdown_raw":null},"unknown":{"score":76,"weight":0.25,"evidence":"第1話の記録（1時間21分・宛先は自分・「生きてるよ」）→第2話の美月宛メッセージ→第3話のニジ出現→第4話の会話／部活という非接触時間の記録→第6話の宛先リスト→第7-8話の正体開示→第12話の自分宛最終記録、と未知が世代交代しながら持続する。","judgment":"第12話の「宛先は自分」は全作品を再文脈化する真正の驚きであり、未知の頂点が最後に置かれている。減点理由は中盤で「領収書」という比喩系の説明が未知の提示を上回る場面があること。"},"desire":{"score":73,"weight":0.25,"evidence":"知りたさは「自分のスマホに他人の指があった」という端末侵害の不安に、読者自身の既読無視・打っては消す経験が乗り移って成立する。湊スレッド（第6話で「最後に返すと何かが変わる」）は知りたさの対象として設定されるが、恋慕の行方は低沸点で推移する。","judgment":"未知の多くは読者が所持する画面操作の身体性に繋がっており、乗り移りの効率が良い。ただし中盤の比喩の説明帯では「閉じたい」が「なるほど」に弱まる。"},"continuity":{"score":83,"weight":0.15,"evidence":"第1話の「誰が打った」→ニジ出現（第3話）→「ニジとは何か」→正体開示（第7-8話）→「どうすれば還るか」→返却メカニズム（第9話）→「最後の宛先は誰か」→湊（第11話）→「最初の記録は誰宛てか」→自分（第12話）まで、毎話の答えが次話の問いを開く。断線する継ぎ目は第1話から第12話まで検出されない。","judgment":"「閉じるとき次の問いが開いている」の教科書的な連鎖。第5話の「届いてる／届いてない」の狭間はテーマ的な反響であり、問いの切れは鋭い。"},"progression":{"score":82,"weight":0.15,"evidence":"各返却（小春・疎遠の友・湊）はニジが薄くなっていくという形で幹を分割応答しており、枝の答えが幹を進める。幹の最終回答（自分宛の記録）は第12話まで温存され、第6話で提示した「最後に返すと何かが変わる」の約束が第11話で回収される。","judgment":"間隔∝問いの大きさがおおむね成立。第4〜6話は幹への応答がやや説明寄りで、問いの前進速度が一時的に緩むのが惜しまれる。"}},"value_vector_contribution":{"narrative_originality":null,"quality":null,"emotional_power":null,"plot_architecture":null,"character_depth":null,"prose_style":null,"theme_resonance":null,"world_building":null,"narrative_technique":null,"reader_experience":null,"admiration":null,"hook":78},"classification":"current_success","confidence":82,"strengths":["与えてから欠けさせる順序が冒頭で成立する——既読無視・返事を打っては消すという回避行動をまず読者に所持させ、その器に午前二時の記録という欠けを植える。「関係を壊さない」の反復が「宛先に返す」への伏線になっている。","継ぎ目に断線がない——第1話から第12話まで、毎話の答え（誰が打った→ニジ→正体→返却→最後の宛先）が次の問いを開き続ける。途中で答えが着地して問いが生まれない場面は検出されない。","幹が頂点まで温存される——「最初の記録・自分宛の言葉」の意味を第12話まで明かさず、最終話で「私が自分に時間を預けていた」という回答が全作品を再文脈化する。問いの大きさに比例した間合い。","枝の回答が幹の分割応答——小春・疎遠の友・湊への返却は、その都度ニジが薄くなるという形で幹を前進させる。返却という行為が開示そのものと一体化している。"],"weaknesses":["中盤（第4〜6話）で比喩系の説明が問いの提示を上回る——「会話」「部活」が領収書になる新しい未知は提示されるが、展開は理論の説明に寄り、前へ引く力が弛む。この帯は器への注水であり、駆動力が弱い。","湊への恋慕スレッドが低沸点——「最後に返すと何かが変わる」と第6話で約束されるが、その行方への知りたさが静かに抱えられ、第11話までの緊張が弱い。乗り移りの対象が乏しい。","最終話はエンジンを閉じて冷める——「また明日」の残り火は正しい終わり方だが、興味の山は冒頭〜中盤に偏在し、終盤は感動（閉じた充足）が興味（開いた問い）を上回る。"],"unique_perspective":"このエンジンの正体は、未知を「スマホ操作という身体性」に植えたことにある。他人の指が自分の端末を打つという感覚の侵害が、既読無視という読者自身の回避行動への既視感と結びつき、「私も同じことをしている」という乗り移りを成立させている。開示の頂（第7-8話）の短さは欠陥ではなく、あの場は未知の答えではなく「どう返すか」という新たな問いの起点であり、密度を増やすより問いを開く機能に徹している。","red_flags_triggered":[],"green_flags_detected":["与えてから欠けさせる","閉じるとき、次の問いが開いている","枝の応答が幹の分割応答","幹が最後まで温存","間隔 ∝ 問いの大きさ"],"improvement_suggestions":["中盤の比喩系の説明を問いの形に還元する——たとえば宛先リストの開示時に「返さないとどうなるか」という期限や具体的なリスクを立てれば、第4〜6話の弛みを防げる。","湊スレッドにもう一つ小さな未知を立てる——第6話で「湊のスマホにも宛先リストがある」とほのめかす程度の断片を早めに挟み、読者の推測を競わせれば低沸点を補える。","開示の頂（第7-8話）は散文を増やすより、ニジが結晶した「受け取らなかった感情」の具体例を一つ増やすことで密度を担保する。"],"content_type":"text","evaluation_timestamp":"2026-08-22T12:00:00+09:00","expected_disagreement_points":[{"evaluator_type":"plot-architecture","predicted_stance":"開示の頂（第7-8話）が約1100字と他話より短い点に機構上の懸念を示す可能性がある。ただし開示の前後で枝が幹を分割応答しており、配置としては成立していると見るだろう。むしろ最終話で自分宛の記録を温存した配置を評価するはずだ。"},{"evaluator_type":"anti-generic-story-filter","predicted_stance":"「スマホに現れる精霊」という現代ファンタジーの典型装置として減点する可能性がある。ただし時間＝領収書という比喩系と、既読無視を「返すべき時間」に転換する発想で差別化されていると反論できる。"},{"evaluator_type":"reader-experience","predicted_stance":"最終話の感動的な着地を高く評価し、読了体験は高水準と見るだろう。一方で興味エンジンの山は冒頭〜中盤に偏り、終盤は感動が興味を上回る——機構と体験で評価の山がずれると予測する。"}],"narrative":"この作品のエンジンは、冒頭の九行で点火されている。既読無視・「打っては消す」という回避行動をまず反復で所持させ、その直後に午前二時の記録という欠けを植える。ここで重要なのは、欠けの正体（誰が打ったか）よりも、その未知が読者の手元のスマホへ乗り移る点だ。「私のスマホにも、返さないままのトークがある」という既視感が、知りたさの燃料になる。第1話の「関係を壊さない」という言葉は、後に「宛先に返す＝壊すかも知れない関係へ踏み出す」へ反転し、与えが最後まで効いている。継ぎ目は全編で切れない——誰が打った（第1話）→ニジ出現（第3話）→正体（第7-8話）→返却（第9話）→最後の宛先（第11-12話）まで、毎話の答えが次の問いを開く。特に第12話の「宛先は自分」は、それまでの全記録を別の読みに塗り替える真の驚きで、幹は頂点まで温存された。\n\nただしエンジンの回転はどこも同じではない。第4〜6話の帯は、「会話」「部活」が領収書になるという新たな未知を提示するが、その扱いが比喩系の説明に傾き、「なるほど」が「閉じたい」を上回る。ここは器への注水であり、前へ引く力は弛む。湊スレッドも低沸点で、第6話の「最後に返すと何かが変わる」という約束はあるが、その行方への知りたさは静かに抱えられたまま第11話まで漂う。開示の頂（第7-8話）の短さは、あの場が未知の答えではなく「どう返すか」という新たな問いの起点であるため、エンジンの点火は損なわれない。密度より機能に徹した判断として評価できる。\n\n総合すれば、これは「継ぎ目に隙が無く、幹を頂点まで温存した」構成であり、51-70の帯を超える。減点は中盤の弛みと終盤の冷却——最終話の「また明日」は残り火として正しいが、エンジンは冒険の終わりに静かに止まる。作品全体として「止まらない」のは冒頭から中盤までで、終盤は感動という閉じた充足が開いた問いを上回る。それでも、第12話の再文脈化は、読み終えた読者を最初の夜へ連れ戻す最初のフックであり、エンジンの設計としては高水準と見る。"}