{
  "evaluator_id": "character-role",
  "evaluator_name": "Character Role Evaluator",
  "content_summary": "退職十日前の刑事が、自ら封印した未解決失踪事件の消しかけの丸印と再会し、現職政治家の圧力に逆らって検察へファイルを提出する物語。",
  "content_type": "text",
  "domain": "pure-literature",
  "primary_score": 66,
  "primary_score_rationale": "賭け・挑戦・一致・自律・融合が揃い、人物が反応ではなく選択で物語を閉じる自律的行為者だが、挑戦の具現化が使者一人と気配の暗示に留まり、犠牲の実際の場面が描かれないため上限を抑える。",
  "dimension_scores": {
    "stake": {
      "score": 62,
      "weight": 0.25,
      "evidence": "退職を十日前に控えた主人公が、自ら消しかけの丸印を残した未解決事件に再び向き合うことで、穏やかな幕引きを失い得るものとして曝す。",
      "judgment": "賭けは良心の傷として一つの所作に具体化されており、主人公を除けば物語の道徳的核心が失われる。"
    },
    "challenge": {
      "score": 55,
      "weight": 0.15,
      "evidence": "事件の関係者である現職政治家の後援会関係者が直接圧力をかけ、机の上のファイルが少しずれる監視の気配も描かれる。",
      "judgment": "具体的な向こう側は存在するが、敵の抵抗は使者一人と暗示に留まり、具現化が浅い。"
    },
    "consistency": {
      "score": 72,
      "weight": 0.20,
      "evidence": "机の整理の律儀さ、ファイルの位置を記憶する几帳面さ、消しかけの丸印をもう一度なぞる所作が、抑制的で執拗な人物像として一貫する。",
      "judgment": "場面を越えてその人らしい応答が保たれ、動きと人物が一致しており、プロットの都合で揺れない。"
    },
    "autonomy": {
      "score": 70,
      "weight": 0.25,
      "evidence": "警告の名刺に触れず、退職の日にファイルを検察へ出す選択が物語の帰結そのものを生む。",
      "judgment": "安穏な終わりという代償を承知で踏み出すリスクテイクであり、出来事への反応ではなく選択がプロットを前に進める。"
    },
    "fusion": {
      "score": 68,
      "weight": 0.15,
      "evidence": "捜査の再開という主人公の機能が、自ら消しかけた丸印という過去の妥協の傷の発現として自然に結びつく。",
      "judgment": "機能が傷から生まれ、なおかつ実際に行動する動く人として成立している。"
    }
  },
  "value_vector_contribution": {
    "narrative_originality": null,
    "quality": null,
    "emotional_power": null,
    "plot_architecture": null,
    "character_depth": null,
    "character_role": 66,
    "prose_style": null,
    "theme_resonance": null,
    "world_building": null,
    "narrative_technique": null,
    "reader_experience": null,
    "admiration": null,
    "hook": null
  },
  "classification": "current_success",
  "confidence": 83,
  "strengths": [
    "消しかけの丸印が賭けと傷を一つの所作に集約する構造的確かさがあり、内面の葛藤が具体的な物として機能する",
    "主人公を除けば事件の道徳的核心が失われる——取り除いたら失われる賭けが本物である",
    "反応ではなく選択で物語を閉じる自律的行為であり、検察への提出が物語の帰結を直接生む"
  ],
  "weaknesses": [
    "挑戦の具現化が薄く、敵は使者一人と気配の暗示に留まり、抵抗の段階が描かれない",
    "賭けが実際に費やされる瞬間、つまり安穏が壊れる場面が暗示に留まり、犠牲の場面が弱い",
    "リスクの内実が読み手の想像に委ねられ、代償の重みが散文の行間でしか感じられない"
  ],
  "unique_perspective": "この人物の動きは「消しかけの丸印」という一つの物理的所作に結晶する。検察へ提出する前に鉛筆でもう一度丸をなぞる——この再描画こそが、過去の封印を消さずに引き受けるリスクテイクの本体であり、プロットを動かす因果の接続と人物の内的必要が同一点で交差する。",
  "expected_disagreement_points": [
    {
      "evaluator_type": "character-depth",
      "predicted_stance": "内面は行間に委ねられるが、消しかけの丸印という傷が深く、高く評価するだろう"
    },
    {
      "evaluator_type": "plot-architecture",
      "predicted_stance": "挑戦の具現化が薄く、敵の抵抗が使者一人に留まり、因果の設計としては不完全と見るかもしれない"
    }
  ],
  "green_flags_detected": [
    "犠牲を伴う選択——穏やかな退職を捨てて検察へ提出する",
    "取り除いたら失われる——主人公の再会が物語の核である",
    "動きが一貫——几帳面な応答が場面を越えてその人らしく保たれる",
    "機能が傷・欲求の発現——捜査の再開が過去の妥協の償いとして自然に生まれる"
  ],
  "narrative": "主人公は動く。二十五年前、自ら消しかけの丸印を残して事件を終わらせた人間が、退職十日前にその丸印と再会し、今度は消さないと決める。この人物から退職の穏やかさを奪う瞬間こそが賭けの正体であり、賭けは「消しかけの丸印」という物として具現化されている。取り除けば事件の道徳的核心が失われる——ここまでは動きの証しとして申し分ない。\n\nだが、向かう先が薄い。敵は名刺を置いていく使者一人と、机の端がずれる気配の暗示に留まる。主人公が何に対して立ち向かい、その抵抗がどのように跳ね返るかの段階が描かれず、犠牲が実際に費やされる場面は想像に委ねられる。挑戦と賭けはあるが、その衝突の実景が見えないまま物語は閉じる。\n\nそれでも、最後の所作は確かな自律である。警告に応じるのではなく、鉛筆でもう一度丸をなぞり、ファイルを検察へ出す。この再描画は反応ではなく選択であり、物語の帰結そのものを生む。プロットが運ぶ駒ではなく、自分の賭けでプロットを前に進めた動く人——それがこの人物の位置だ。具現化の浅さが上限を抑えるが、動きの原理は本物で、消さなかった丸印が因果と内的必要を一点で結んでいる。"
}
