{"evaluator_id":"character-role","evaluator_name":"Character Role Evaluator","content_summary":"退職間際の刑事・沢木が二十年前の少女失踪事件の資料に供述の食い違いを見つけ、朽木という市長候補へ繋がる資料を県警本部に届けるまでを描いた物語。","domain":"genre-fiction","content_type":"text","primary_score":59,"primary_score_rationale":"賭け・挑戦・一致・リスクテイクが構造的に描かれ、人物が物語を前へ動かすが、類型に寄り、推進力が悔恨という強迫に半ば委ねられているため、行為者としては中位にとどまる。","dimension_scores":{"stake":{"score":60,"weight":0.25,"evidence":"二十年前に見つけられなかった悔恨が唯一無二の賭け。退職により外部的に失う立場は少ないが、届けなければ事件はまた二十年眠る——失うものは彼固有の良心の平穏。取り除けば事件は眠ったままになる。","judgment":"賭けは私的な悔恨に位置し、具体的な喪失の輪郭こそ弱いが固有性はある。賭けは実在する。"},"challenge":{"score":52,"weight":0.15,"evidence":"朽木という名と後援会関係者の脅迫が具体的な「向こう側」を形成する。ただし対峙は一度の訪問と沈黙にとどまり、賭けを実際に揺さぶる攻防としては薄い。","judgment":"挑戦の対象は明示されるが深くは交戦していない。向かう先はあるが細い。"},"consistency":{"score":58,"weight":0.20,"evidence":"資料に気づき、関係者を訪ね、脅しに黙り、それでも届ける——一貫して「悔恨に突き動かされる刑事」の動き方を保ち、場面を越えて揺れない。","judgment":"らしさはあるが退職刑事の類型に寄り、応答が既視感を抜けない。"},"autonomy":{"score":62,"weight":0.25,"evidence":"資料に気づき、関係者を訪ね、県警本部へ届ける——選択が物語の結末を生む。届け出は退職の平穏と安全を代償にしたリスクテイク。ただし「足を止められなかった」という描写は選択というより強迫に近い。","judgment":"生む主体ではあるが、能動が悔恨という推進力に委ねられ、自由な選択としての輪郭がやや弱い。"},"fusion":{"score":60,"weight":0.15,"evidence":"刑事の機能が「見つけられなかった」傷の自然な発現であり、かつ実際に行動する。悔恨がそのまま捜査を駆動し、動く記号ではなく動く人になっている。","judgment":"傷と機能は一致し行動するが、その傷自体が定番の型で、融合の深みは限定的。"}},"value_vector_contribution":{"narrative_originality":null,"quality":null,"emotional_power":null,"plot_architecture":null,"character_depth":null,"character_role":59,"prose_style":null,"theme_resonance":null,"world_building":null,"narrative_technique":null,"reader_experience":null,"admiration":null,"hook":null},"classification":"current_success","confidence":68,"strengths":["悔恨という賭けがそのまま物語の駆動力になっており、人物を取り除けば事件は眠ったままになる——賭けが因果に接続されている。","県警本部へ資料を届ける選択が、退職の平穏と安全を代償にしたリスクテイクとして機能している。","脅迫という具体的な挑戦を前に黙しつつも踏み出す、という動き方が場面を越えて一貫しており、能動の原理が読める。"],"weaknesses":["主人公が退職刑事という類型に寄り、悔恨の輪郭も「見つけられなかった」という定番の傷を抜けていない。","挑戦が薄い——朽木は名前と一度の脅迫にとどまり、賭けを本気で揺さぶる具体的な攻防がない。","「足を止められなかった」という描写が、行動を自由な選択でなく強迫として描き、自律性を弱めている。"],"green_flags_detected":["犠牲を伴う選択","賭けが因果に接続","取り除いたら失われる","動きが一貫","機能が傷・欲求の発現"],"unique_perspective":"この人物は動いているが、その推進力が悔恨というエンジンに占有されており、行動が「選んだ」ではなく「止まれなかった」として描かれるところに、動きの狩人には厄介な捻れが見える。賭けが本物であることの証明であるリスクテイク（届け出）が、実は本人の足を止めない惰性に近い形で起こるため、動きの源が人物の外側——傷そのもの——に移っている。動くが、動かされている。","expected_disagreement_points":[{"evaluator_type":"character-depth","predicted_stance":"二十年来の悔恨を内面として評価し動機の真実味は認めつつも、肖像が短く類型に寄るため高得点はつかないと予測。"},{"evaluator_type":"plot-architecture","predicted_stance":"因果が薄く、事件の結末（朽木への追及）が描かれないためプロット構造としては低評価になると予測。人物の行動が因果を閉じていないという対立が想定される。"}],"narrative":"退職間際の刑事・沢木は、机の片付けのさなかに資料へ手を伸ばした瞬間から、プロットに運ばれる存在であることをやめる。供述の食い違いに気づく——それは二十年前の自分が見落としたものだ。ここから先、彼を動かすのは退職でも後輩の制止でもなく、「見つけてやれなかった」という消えない悔恨。この一手で、賭けは固有のものになる。取り除けば事件は眠ったまま。彼は少なくとも、誰とでも取り替えのきく駒ではない。\n\nだが、動きの質はまだ定番を抜けない。関係者を訪ねるのも、朽木という名前に触れるのも、脅しに黙るのも、すべて「悔恨に突き動かされる退職刑事」の型の中にある。唯一の自律的行為——県警本部へ資料を届ける選択——は、退職の平穏と安全を代償にした本物のリスクテイクであり、これが物語の結末を生む。しかしそれを支える語りは「届けなければ、また二十年眠ったままになる。そう思うと、足を止められなかった」という、選択ではなく強迫の言葉である。彼が動かしているのか、悔恨が彼を動かしているのか、境界が曖昧なのだ。\n\n要するに、これは動く人物の下級生である。賭けは本物で、挑戦の向こう側は見え、動きは一貫し、一つだけ決定的なリスクを踏む。だがその推進力は人物の自由な決定から半ば外れており、しかも挑戦は一度の脅迫で止まるため、賭けを本気で揺さぶる攻防がない。動きの源が傷という既製品に寄りかかっている限り、本物の行為者に至るにはあと一歩が要る。","evaluation_timestamp":"2026-08-20T00:00:00Z"}
