{
  "evaluator_id": "character-role",
  "evaluator_name": "Character Role Evaluator",
  "content_summary": "定年退職直前の看護師が、二十年前の観察記録の食い違い（二時間で点滴が100違うことと自分の字による「訂正」）を発見し、退職式で公に読み上げるまでを描く短編。",
  "domain": "genre-fiction",
  "content_type": "text",
  "primary_score": 83,
  "primary_score_rationale": "主人公はプロットに運ばれるのではなく、自らの選択で物語を動かし、退職式での公開暴露という犠牲を伴う選択で本物の賭けを示した。挑戦の相手がやや間接的である点と、対峙の手前で結末を迎える点を差し引いて83点。",
  "dimension_scores": {
    "stake": {
      "score": 82,
      "weight": 0.25,
      "evidence": "「訂正」が主人公自身の筆跡であるため、賭けは正義の追及ではなく自らの加担の可能性へと個別化され、三十年のキャリアの意味そのものが掛かっている。主人公を取り除けば物語の起動点そのものが消える。",
      "judgment": "賭けは深く個人的で本物。記録を放置して退職することは、三十年を無意味に終えることと同義になる。取り除いたら失われる条件を満たす。"
    },
    "challenge": {
      "score": 78,
      "weight": 0.15,
      "evidence": "若い医師の存在を記録から「直して」消した部門、記録を再封印してガムテープを折り返す手、退職を急かす電話、有給の強要。賭けが具体的な「向こう側」に脅かされている。",
      "judgment": "挑戦の相手は具体的だが、中心の敵役（今は偉くなった医師）が最後まで姿を見せず、対峙の緊張が主任や師長といった間接的な圧力に依存している。向かう先は明瞭、実体は影。"
    },
    "consistency": {
      "score": 85,
      "weight": 0.20,
      "evidence": "箱を数えて十一しかないことに気づく几帳面さ、二十年前と変わらぬ読む速さ、記録の角を親指で弾く仕草。応答は「来月まである」「知ってる」「そういう意味」と一貫して乾いて果断。",
      "judgment": "場面を越えてその人らしさが揺るがない。「気づかずにいられない」性質が能動の原理として一貫しており、プロットの都合で動く場面がない。"
    },
    "autonomy": {
      "score": 86,
      "weight": 0.25,
      "evidence": "箱を開ける、写しを取る、事務員を追う、有給を断る、退職式で公に読み上げる——どの場面も出来事への反応ではなく、出来事を生む選択。退職式での公開は、きれいに終えられたはずの三十年を犠牲にする踏み込み。",
      "judgment": "自律性が際立つ。花束も拍手も安全な退職も捨てて選択し、最後まで払い続ける覚悟のまま外来へ歩き出す。犠牲を伴う選択が物語を動かしている。"
    },
    "fusion": {
      "score": 84,
      "weight": 0.15,
      "evidence": "主人公（追跡者）という機能が、看護師としての職業的気質（記録の食い違いを看過できない）と、自らの筆跡が残る「訂正」という個人的由来の自然な発現になっている。機能が貼られたラベルではなく、人が行動として引き受けている。",
      "judgment": "動く記号ではなく動く人。職業・気質・傷の影がそのままロールを形成し、かつ実際に行動している。"
    }
  },
  "value_vector_contribution": {
    "narrative_originality": null,
    "quality": null,
    "emotional_power": null,
    "plot_architecture": null,
    "character_depth": null,
    "character_role": 83,
    "prose_style": null,
    "theme_resonance": null,
    "world_building": null,
    "narrative_technique": null,
    "reader_experience": null,
    "admiration": null,
    "hook": null
  },
  "classification": "current_success",
  "confidence": 85,
  "strengths": [
    "主人公の能動の原理（気づかずにいられない几帳面さ）がそのまま物語の因果を生み、箱を数えて一冊足りないと気づく細部が追跡の起点そのものになっている。",
    "退職式での公開暴露は、きれいに終えられるはずの三十年と花束と拍手を犠牲にする本物のリスクテイク。",
    "「訂正」が自分の字であるという設定が、賭けを正義の追及から自己の加担の可能性へと個別化し、逃げられない固有のものにしている。",
    "挑戦の相手（記録の再封印・退職を急かす電話・有給の強要）が具体的に描かれ、賭けが実際に脅かされている。"
  ],
  "weaknesses": [
    "中心の敵役たる「今は偉くなった」医師が最後まで姿を見せず、対峙の緊張が主任や師長といった間接的な圧力に依存している。",
    "結末が対峙の手前で途切れており、歩き出す選択自体は自律的だが、その選択が物語をどこまで変えるかは示されない。"
  ],
  "unique_perspective": "この人物が本物の行為者である所以は、動機が正義ではなく自責にある点だ。「訂正」が彼女自身の字であるため、記録を放置して退職することは三十年を無意味にして終わることと同義になる。つまり彼女は動かざるを得ない。動かないこと自体が最大の敗北になるように賭けが設計されている。この「静止すること自体が最も深い損失」という逆転が、傍観者の賭け（持っているが一度も行動しない）と彼女の賭けを分かつ。傍観者は待っていられるが、彼女は待つことが既に負けなのだ。",
  "expected_disagreement_points": [
    {
      "evaluator_type": "character-depth",
      "predicted_stance": "内面の贖罪と過去の葛藤、退職式で拍手が起きない沈黙の重みを「深さ」として高く評価するだろう。私は同じ場面を犠牲を伴う選択すなわち動きとして見る。両者は直交するため激しくは対立しない見込み。"
    },
    {
      "evaluator_type": "plot-architecture",
      "predicted_stance": "短編で因果の余地が小さく、謎が解決されないまま結末を迎えるため機構面の薄さを低評価し得る。私は因果が人物の選択から生まれている点を評価するため、機構の薄さとロールの強さが乖離するだろう。"
    }
  ],
  "green_flags_detected": [
    "犠牲を伴う選択",
    "取り除いたら失われる",
    "賭けが因果に接続",
    "動きが一貫",
    "機能が傷・欲求の発現"
  ],
  "narrative": "動きの狩人として見る。この物語を動かしているのはプロットではない。ひとりの看護師が「開けないと捨てられないでしょう」と箱を開ける、その指の動きである。彼女は最初の場面から、閉じることに抵抗する。開けたら捨てられなくなると分かっていて開ける。箱を数えて十一しかないことに気づく。二十年前と同じ速さで記録を読む。この「気づかずにいられない」性質こそが彼女の能動の原理であり、それがそのまま因果の源になっている。彼女を取り除けば、この物語は何も起きない。記録の箱は捨てられ、退職式は三〇秒で終わる。\n\n賭けは深く個人的だ。発見した「訂正」は彼女自身の字だった。つまり彼女が追っているのは正義ではなく、自らの加担の可能性である。三十年のキャリアの意味そのものが掛かっている。有給二十日を与えられ、花束の色を聞かれ、電話で引導を渡される——すべて「それ以上見るな」という力であり、彼女はその都度、断る。退職式で自ら台に立ち、二枚の記録の差を読み上げる選択は、きれいに終えられたはずの三十年を犠牲にする行為だ。犠牲を伴う選択こそ、賭けが本物であることの証明である。\n\n挑戦の相手は具体的だ。若い医師の存在を「直して」消した部門、記録を再封印する手、電話の女、有給を押し付ける師長。彼女はこれらすべてに乾いた一行で立ち向かう。「来月まである」「知ってる」。ただし、中心の敵役は最後まで姿を見せない。対峙の緊張を主任や師長が肩代わりしている点が、挑戦の実体をやや影にする。それでも最後、外来へ向かって歩き出す足は、犠牲を払った者の足ではない。払い続ける覚悟のある者の足である。彼女は動く人そのものだ。",
  "evaluation_timestamp": "2026-08-21T00:00:00Z"
}
