{"evaluator_id":"hook","evaluator_name":"フック評価者（Hook Evaluator）","content_summary":"抗争中の組織で若頭が内通者を疑い、仲介人への密告が届いて追い詰めるが、その背後に別の思惑が浮上する筋書き。","domain":"genre-fiction","content_type":"plot","primary_score":50,"primary_score_rationale":"『誰が内通者か』という最小の問いは立つが、読者が所持する絆・像・信頼の約束が先に与えられておらず、知りたさが乗り移る土台が薄い。答えは調査ではなく密告として与えられ、次の『背後の思惑』も具体性を欠くため、エンジンは最後まで回るが点火は弱い。","dimension_scores":{"investment":{"score":40,"weight":0.20,"evidence":"若頭の苛立ちと内部漏洩という前提のみで、追う人物やその仲介人との絆・像・信頼の約束が結ばれる前に疑いが始まる。","judgment":"未知を気にかける土台が弱く、立ち上がる疑いが人物感情へ乗り移っていない。"},"unknown":{"score":60,"weight":0.25,"evidence":"『誰が漏らしているか』という予測を開いた問いが立つ。密告による答えの後に『仲介人の背後の思惑』という次の未知が開かれ、閉じ切らない。","judgment":"初手の問いは真に開いており、答えの後に続く未知も用意されている。"},"desire":{"score":40,"weight":0.25,"evidence":"内通者の正体という知りたさはあるが、若頭の失うものや仲介人の信用・利害が読者に所持されていないため、閉じたい対象へ乗り移っていない。","judgment":"未知はあるが知りたさが弱く、器だけに近い。"},"continuity":{"score":65,"weight":0.15,"evidence":"仲介人が内通者という答えの着地が、『その背後に別の思惑がある』という問いを同時に開く。継ぎ目で線が切れず、次へ繋がる。","judgment":"閉じるときに次の問いが開いており、連鎖の継ぎ方が整っている。"},"progression":{"score":45,"weight":0.15,"evidence":"内通者の正体が調査による発見ではなく匿名の密告として与えられ、若頭の行動が答えに近づいていない。","judgment":"枝の答えが幹を動かす手応えが薄く、幹の温存はあるが推進力が先送りに寄っている。"}},"value_vector_contribution":{"narrative_originality":null,"quality":null,"emotional_power":null,"plot_architecture":null,"character_depth":null,"prose_style":null,"theme_resonance":null,"world_building":null,"narrative_technique":null,"reader_experience":null,"admiration":null,"hook":50},"classification":"discovery_target","confidence":70,"strengths":["内通者の正体という単純で予測を開く問いが冒頭で立てられ、読者を前へ引く最小のエンジンが組まれている。","『密告が届く』答えの着地が『背後の思惑』という次の問いを開き、連鎖が継ぎ目で断線しない。","最後の未知である『別の思惑』が明かされず温存され、読者を最終行の先へ残す構造を持つ。"],"weaknesses":["所持の順序が逆で、若頭の苛立ちはあるが絆・像・信頼の約束が先に与えられておらず、知りたさが乗り移る対象が弱い。","内通者の正体が調査の成果ではなく匿名の密告として一方的に与えられ、幹へ近づく推進力が不足する。","最終フックの『別の思惑』が抽象的で、何を失うかが示されないため器だけに近い。","若頭の動きが行き詰まったまま外部の便りに頼り、主人公の行為が答えを引き寄せていない。"],"unique_perspective":"この筋書きを興味エンジンとして見ると、『誰が内通者か』という問いは立つが、その答えが主人公の探求ではなく一通の密告で届く点で、知りたさの報酬が安く済まされている。問いの解消が抽斗から出てくる仕組みであり、続きを引く力は『背後の思惑』という新たな器に頼るばかりで、前の器を閉じる手応えを稼げていない。","expected_disagreement_points":[{"evaluator_type":"plot-architecture","predicted_stance":"匿名の密告による解決を偶然の都合と見なし、開示機構の弱点として低く評価すると予測。一方、背後の黒幕という転結自体はジャンルの定石として評価する可能性もある。"},{"evaluator_type":"reader-experience","predicted_stance":"理知的には読めても、人物への没入対象が薄く、読者が感情的に引き込まれたとは言い難いと低めに評価すると予測。"}],"narrative":"まず器を見ると、読者に所持させるものが薄い。若頭の苛立ちと『内部に漏れている』という前提は置かれるが、追うべき相手との絆や像、信頼の約束が先に与えられないまま疑いが始まる。したがって『誰が内通者か』という未知は立ちながら、その知りたさが乗り移る土台が無い。未知だけが先に立つ器だけの立ち上がりで、点火温度は低い。\n\n連鎖を追うと、『誰か』という問いが『一通の密告』で答えられ、同時に『背後の別の思惑』という次の問いが開く。この継ぎ目自体は整っており、閉じるときに次の問いが開いている。しかし前の答えが若頭の探求ではなく外部の便りとして与えられるため、読者が得るのは答えではなく新しいラベルでしかない。知りたさの報酬が安く、前へ引く力が幹に届いていない。\n\n全体の問いである『背後の思惑』は最終行まで温存され、続きを気にさせる形だけはある。だがそれが具体性を欠くため、未知はあっても閉じたい対象になっていない。エンジンは最後まで回ってはいるが、点火は弱く、燃料となる所持が不足している。","red_flags_triggered":["器だけ"],"green_flags_detected":["閉じるとき、次の問いが開いている","幹が最後まで温存"],"improvement_suggestions":["若頭と組織、あるいは仲介人との間に、読者が先に所持する絆や信頼の約束を置いてから欠けさせる。","内通者の正体は密告で与えず、若頭自身の調査が一歩届く手前で開示し、答えを得る行為と連鎖させる。","『背後の思惑』には失われるものを示し、読者が閉じたくなる対象を先に与える。"],"evaluation_timestamp":"2026-08-20T00:00:00Z"}
