{
  "evaluator_id": "character-role",
  "evaluator_name": "Character Role Evaluator",
  "content_summary": "退職を控えた人物が、二十年前に自分が判を押した承認文書を発見し、封印された決裁者を追跡して、圧力と引き換えの退職提示に抗い、会長へ文書を突き付けるまで",
  "domain": "pure-literature",
  "content_type": "text",
  "primary_score": 66,
  "primary_score_rationale": "逡巡を出発点に、圧力を跳ね返し、顧問の椅子を蹴って文書を突き付ける自律的行為者であり、動きは物語を前に運んでいる。ただし敵の抵抗が消極的で、最終行為の効果が無化されるため、稀な域には届かない。",
  "dimension_scores": {
    "stake": {
      "score": 62,
      "weight": 0.25,
      "evidence": "退職を控えた人物が、二十年前に自分が判を押した承認文書を発見し、退職の扱い見直しという圧力を受ける。文書の各頁に本人の判が残り、取り除けば物語の前提が崩れる。",
      "judgment": "賭けは実在するが、失うものが退職処遇という外的な圧力に偏り、かつて承認したという内的な掛け金は示唆に留まる。"
    },
    "challenge": {
      "score": 55,
      "weight": 0.15,
      "evidence": "追及への圧力、記録庫での閲覧拒否、上司の退職見直し示唆、会長との応接室対峙と、立ち向かう対象は連なって存在する。",
      "judgment": "挑戦は実在するが、敵の抵抗が直接的な衝突へ発展せず、最終対峙で相手が文書を見ないまま消極化するため、向こう側との力の噛み合いが弱い。"
    },
    "consistency": {
      "score": 78,
      "weight": 0.20,
      "evidence": "文書を捨てる箱に入れてから取り出す逡巡、消された名を指でなぞる動作、声が小さく漏れる拒否の応答、招かれた席に座らない選択が、静かで抑制的な動きとして一貫する。",
      "judgment": "場面が変わっても人物の応答が一貫しており、能動の原理がはっきり読める。"
    },
    "autonomy": {
      "score": 70,
      "weight": 0.25,
      "evidence": "文書を取り戻す、記録庫を訪ねる、圧力を跳ね返す、会長に文書を突き付けるまでの選択が次々に出来事を生み、退職処遇と顧問の椅子という代償を承知で踏み出している。",
      "judgment": "能動的に物語を動かし、犠牲を伴う選択をしている。ただし最終行為の効果が無化され、選択の帰結が宙に残るため満点には届かない。"
    },
    "fusion": {
      "score": 62,
      "weight": 0.15,
      "evidence": "本人の判が全頁に残るという事実が、追及者という機能を内側から支え、起案者の追跡から会長への対峙へと自然に接続する。",
      "judgment": "機能が人物の来歴（かつて自ら承認した事実）と噛み合っており、貼り付けたラベルではない。ただし内面の動機が抑制され、やや記号的に映る余白が残る。"
    }
  },
  "value_vector_contribution": {
    "narrative_originality": null,
    "quality": null,
    "emotional_power": null,
    "plot_architecture": null,
    "character_depth": null,
    "character_role": 66,
    "prose_style": null,
    "theme_resonance": null,
    "world_building": null,
    "narrative_technique": null,
    "reader_experience": null,
    "admiration": null,
    "hook": null
  },
  "classification": "current_success",
  "confidence": 78,
  "strengths": [
    "全頁に残る本人の判が、追及という機能を物語の前提から支え、取り除けない固有の賭けを形成している",
    "圧力に直面しても小さく「ない」と拒み、顧問の椅子を蹴って文書を突き付ける一連の選択が、次々に場面を生成している",
    "逡巡・指でなぞる・座らないといった動作が一貫し、静かで抑制的な能動の原理が読める"
  ],
  "weaknesses": [
    "会長という向こう側が文書を見ないまま対峙が消極的に終わり、挑戦の抵抗が直接的な衝突へ発展しない",
    "最終行為の効果が無化され、リスクテイクが行動としては成立しても、その帰結が宙に残る",
    "賭けが退職処遇という外的な圧力に偏り、かつて承認した罪という内的な掛け金は示唆に留まり、宙に浮く余地がある"
  ],
  "unique_perspective": "この人物の自律性は「文書を突き付ける」という能動で成立しているが、相手がそれを見ないという応答に、プロットが既に支配を取り戻そうとする兆候が潜む。動きの頂点と同時に、機構がその効果を無化する構図こそが、この作品の特異点である。",
  "expected_disagreement_points": [
    {
      "evaluator_type": "character-depth",
      "predicted_stance": "抑制された逡巡や小さく漏れる声を内面の深さとして高く評価し、こちらが記号的と見る余白を人間味として肯定する可能性が高い"
    },
    {
      "evaluator_type": "plot-architecture",
      "predicted_stance": "最終対峙が結実しない幕切れを、こちらは効果の無化（プロットの巻き返し）と見るが、機構側は伏線回収を抑えた静かな設計として高く評価するかもしれない"
    }
  ],
  "green_flags_detected": [
    "犠牲を伴う選択",
    "取り除いたら失われる",
    "動きが一貫",
    "機能が傷・欲求の発現"
  ],
  "narrative": "野村は、二十年前に自分が判を押した承認文書を、捨てる箱に入れてから取り戻す。この逡巡こそが動きの始まりだ。捨てるか残すかという、いちばん小さな選択が、物語の最初の一手になる。文書の全頁に残る己の判、その上に線を引かれて消された決裁者。賭けは明確である——この人物を取り除けば、文書も追及も存在しない。退職処遇の見直しという圧力は、掛かったものに現実の痛みを与えている。\n\nしかし、向こう側の抵抗が物足りない。上司は静かに脅し、管理係は顔を上げず、会長は文書を見ようとしない。立ち向かうべき敵は最後まで、突き出された封筒に目を落とさない。挑戦は存在するが、力の噛み合いが弱く、対峙は衝突に発展しない。それでも野村は「きれいに辞めろ」という顧問の椅子を蹴り、文書を突き付ける。これは犠牲を伴う選択であり、代償を承知したリスクテイクである。\n\n一貫性は出色だ。文書を出しかけてしまい、鍵をかけて窓の外を見る。なんども同じ抑制された動きで返す。この静かな人物が、場面を越えて同じ原理で動いている。最終場面で、会長が綴りを見なかった時点で、プロットは既に支配を取り戻そうとしている。動きは頂点に達したが、その効果は宙に残る。それでも、この人物が物語を自分の手で前に運んだことだけは、疑いようがない。"
}
