{
  "evaluator_id": "character-role",
  "evaluator_name": "Character Role Evaluator",
  "content_summary": "退任三週間前の役員が二十年前の改竄された承認文書を発見し、もみ消しを迫る会長の圧力に逆らい、最後の役員会でその文書を机に置く。",
  "domain": "genre-fiction",
  "primary_score": 80,
  "primary_score_rationale": "賭けは本物で挑戦も具体化し、動きの一致は極めて高い。自律性は終幕の一撃に収斂するが、その一撃は代償を承知したリスクテイクである。帰結の可視化が開いたままなのが唯一の減点。",
  "dimension_scores": {
    "stake": {
      "score": 82,
      "weight": 0.25,
      "evidence": "二十年前の承認文書に、綴じるたびにずれる数字の位置と、差し替えの痕である押印の染みが残る。退任役員はそれを握っている——同じ文書を伏せて静かに辞めれば顧問と静穏が得られるのに、公にすれば保身の末裔を断たれる。席替えという報復の予兆がすでに差し込まれている。この人物を取り除けば、文書と向かい合う者も、もみ消しを拒む者もいなくなる。",
      "judgment": "賭けは私的な感慨にとどまらず、事件が実際に脅かす金と地位と二十年来の静穏に接続されている。失い得るものが固有名詞的にこの人物に帰属している。"
    },
    "challenge": {
      "score": 83,
      "weight": 0.15,
      "evidence": "向かう先は具体化されている。上司は手を重ね「残すものだけ残せばいい」と遮り、会長は背を向けたまま「きれいに辞めろ」と言い、白い封筒を置く。その都度、蒸し返すなという側が退任役員の前に実在する。席替えの通知までが動いていて、敵は単なる心情ではなく、椅子を動かせる力として物理的に迫る。",
      "judgment": "賭けには明確な向こう側がある。不安が宙に浮かばず、すべて具体的な相手の手として姿を取る。"
    },
    "consistency": {
      "score": 85,
      "weight": 0.20,
      "evidence": "折り目を伸ばす指、保管庫の綴りを一枚ずつめくる指、紙の端に立つ爪、封筒に触れない手、足を止めずに歩く足、文書を机に置く手。場面が何を投げても、応答は「正確に扱うことをやめない」という同じ原理から出ている。即興ではなく、退任役員という原理がどの場面でも同じ仕草を選んでいる。",
      "judgment": "場面を越えて一貫してその人らしい。動きの一致がこの作品の最も確かな資産であり、物語を動かす根拠にもなっている。"
    },
    "autonomy": {
      "score": 72,
      "weight": 0.25,
      "evidence": "退任役員は稟議書と決裁記録を自発的に辿り、差し替えの痕を突き止める。白い封筒には触れず、応接室の前を通り過ぎ、やがて文書を役員会の席に置く。稟議書の公表は「きれいに辞めろ」という取引を棒に振る選択であり、代償を承知している。その一撃が会議の状態を変え、会長の支配を打ち返す。",
      "judgment": "起こった出来事への反応が前半は多いが、封筒の拒絶と文書の差し出しという二つの局面で選択が次の段階を生んでいる。特に終幕は失う覚悟のあるリスクテイクである。ただし能動の幅はこの一撃に収斂し、帰結は開いたままだ。"
    },
    "fusion": {
      "score": 78,
      "weight": 0.15,
      "evidence": "主人公としての機能——改竄の発見と対峙と公開——は、正確に扱う者という退任役員の生来の動きから出ている。辿る、直す、残す、差し出す、すべて同一の原理の延長である。対する側は「終わったままにせよ」という動かすことへの抵抗として、機能自体が封じ込めの姿勢になっている。動く人と動くことを拒む役割の対構造が成立している。",
      "judgment": "機能が傷や欲求の自然な発現であり、実際に行動する。動く記号ではなく、動く人として主人公が機能し、敵役が反対の動きとして機能している。"
    }
  },
  "value_vector_contribution": {
    "narrative_originality": null,
    "quality": null,
    "emotional_power": null,
    "plot_architecture": null,
    "character_depth": null,
    "character_role": 80,
    "prose_style": null,
    "theme_resonance": null,
    "world_building": null,
    "narrative_technique": null,
    "reader_experience": null,
    "admiration": null,
    "hook": null
  },
  "classification": "current_success",
  "confidence": 82,
  "strengths": [
    "野村のすべてを「正確に扱う手」に集約した動きの原理が、辿る・直す・差し出すまで一貫しており、場面が何を投げてもその人らしい応答になっている。背景とロールが一致する稀な構造。",
    "賭けが金・地位・静穏という具体的な失い得るものに接続され、しかも席替え・委嘱状という現実の出来事が実際にそれを脅かしている。賭けが私的な気分で終わらない。",
    "文書を会議の席に置く終幕が、「きれいに辞めろ」という取引を断ち切る代償付きの選択であり、単なる反応ではなく次の段階を生む決断になっている。"
  ],
  "weaknesses": [
    "文書の公開が引き起こすはずの帰結——会長の反撃、取引の破綻、役員会の転覆——が最後まで宙吊りのままで、選択が物語を変えたことを示す証拠が描かれない。リスクテイクの払い戻しが見えない。",
    "文書が暴くものが何であるか（数字の位置・押印の痕がどう違法なのか）が具体的に示されず、賭けの因果的な重さが「何か重大なこと」という暗示のまま残る。",
    "会長の押さえ込みが印象的で、それに応える野村の能動は二局面に限られる。前半は出来事への応答が優勢で、駒に近い場面が続く。"
  ],
  "unique_perspective": "この作品の動きの現場は、すべて手である。折り目を伸ばす指、ページをめくる指、紙の端に立つ爪、封筒に触れない手、文書を置く手。野村は台詞で抗わないが、動きそのものが拒絶であり、その「触れない」こと自体がリスクテイクである。情動を語らなくても、この手の一貫性こそが彼を駒でなく行為者にしている。",
  "expected_disagreement_points": [
    {
      "evaluator_type": "character-depth",
      "predicted_stance": "depth側は野村を「静止した肖像」と見て低くつける可能性が高い。内面の葛藤や欲望の声がほぼ語られず、変化弧も感情の吐露もない。反論として、深さは経路ではなく動きの一貫性に封入されており、手という行為に溶かし込まれている点を挙げる。"
    },
    {
      "evaluator_type": "plot-architecture",
      "predicted_stance": "plot側は結末が開いたままであることと、文書の中身が抽象的であることを理由に因果の閉じを低くつける可能性がある。こちらは人物の賭けと因果の接続自体は成立していると評価するため、機構の厳密さをめぐって対立し得る。"
    }
  ],
  "red_flags_triggered": [],
  "green_flags_detected": [
    "犠牲を伴う選択",
    "取り除いたら失われる",
    "賭けが因果に接続",
    "動きが一貫",
    "機能が傷や欲求の発現"
  ],
  "improvement_suggestions": [
    "文書の中身（改竄が何を意味するか）の具体性を一段深め、公開の報いと会長の反撃を一描写でも差し込めば、賭けの因果が閉じて自律性がさらに上がる。",
    "終幕の文書差し出しの直後を一行だけ延ばし、会長または役員会の動揺という帰結を見せると、リスクテイクが物語を変えたという根拠になる。"
  ],
  "narrative": "退任役員・野村は、この物語を自分の手で引き受けた。二十年前の改竄文書という賭けを持ち、押さえ込みに走る上司と会長という挑戦に対峙する。何より機能しているのは、動きの一致である。折り目を伸ばす指、綴りを一枚ずつめくる指、紙の端に爪を立てる指、封筒に触れない手、文書を卓上に置く手。会場が何を投げても、野村は同じ原理——正確に扱うことをやめない——から応答し、その一貫性こそが彼をプロットに揺さぶられる駒から行為者へと変えている。景気のよい発話や内面の吐露が一切ないことを、この作品は手の軌跡に賭けて克服している。\n\n自律性は、過去を蒸し返すなという暗黙の取引を断つところで頂点を打つ。「来期も顧問で残る。お前は、きれいに辞めろ」という甘い差し止めに、封筒へ触れないことと、文書を役員会の席に置くことで応える。これは代償を承知した選択であり、観客でなくリスクテイクする側に彼を置く。賭けは金と地位とに接続され、しかも席替えや委嘱状という現実の出来事がそれを実際に揺さぶる。取り除いたら物語が消える、本物の賭けである。\n\n減ずるのは帰結の開きである。文書の公開が何を引き起こしたかが宙に吊られ、会長の反撃も取引の破綻も描かれないため、リスクテイクの払い戻しが見えない。文書が暴くものが何であるかも示されない分、因果の重さが暗示のまま残る。それでも、粘り強く追う者と「終わったままがいい」と押さえ込む者との対構造は鮮明で、動く人と動かぬロールの対決として成立している。この作品の動く力は決して薄くない。唯一、最後の一撃の先が示されないことだけが、動きの狩人を満足の一歩手前で留める。"
}
