{
  "evaluator_id": "narrative-originality",
  "evaluator_name": "Narrative Originality Evaluator",
  "content_summary": "午前二時にスマホへ現れる精霊ニジの正体は、主人公が既読無視や打っては消す行為で「受け取らなかった感情・預けた時間」の結晶であり、宛先リスト三十二人に言葉を返すことで精霊は薄くなり還っていく。最後の宛先は自分自身。",
  "domain": "light-novel",
  "content_type": "text",
  "primary_score": 45,
  "primary_score_rationale": "一つの新前提（スクリーンタイム＝預けた時間の領収書）を従来のヒーリング型の語りで運んだ佳作。前提の新鮮さが形式の凡庸さを押し上げるが、構造そのものの逸脱はない。",
  "dimension_scores": {
    "premise_novelty": {
      "score": 62,
      "weight": 0.35,
      "evidence": "「スクリーンタイム＝宛先ごとの預けた時間の領収書」「受け取られなかった感情の結晶」という中心比喩は、SNS時代の行動様式（既読無視・打っては消す・いいね）に正確に結線され、既知の類型（SNS霊・時間の実体化）からは一段具体性で抜けている。ただし「スマホに現れる精霊が社会不安を癒す」という家族自体は既存の現代ファンタジーに属する。",
      "judgment": "前提は本作の唯一の本物の新しさ。しかし新奇性は「設定」の層に閉じており、前提の家族からは出ていない。"
    },
    "form_deviation": {
      "score": 20,
      "weight": 0.30,
      "evidence": "三人称限定・時系列順・各話「続く」クリフハンガー・開示→返済→別れというヒーリング弧。時間の反復（午前二時）は反復装置として使われるが、時間の扱い自体に変形はない。宛先リストの減少＝精霊の減衰という機構は唯一の形式的工夫だが、語り直しや視点の配置の逸脱は皆無。",
      "judgment": "典型的なジャンル標準の語り。形式の逸脱は検出できない。"
    },
    "genre_distance": {
      "score": 30,
      "weight": 0.20,
      "evidence": "現代ファンタジー・ヒーリングものとして、スマホ/SNS不安＋霊的存在＋情緒的回復のテンプレートに忠実。内気な主人公・優しい後輩・密かな憧れの先輩という配役もジャンル標準。",
      "judgment": "ジャンルのテンプレートに従順。既視感は強いが、領収書比喩の統合度だけが距離をわずかに稼いでいる。"
    },
    "meaningfulness_of_deviation": {
      "score": 55,
      "weight": 0.15,
      "evidence": "領収書の比喩は物語の機械として一貫している——返すとリストが空き、精霊が薄くなる。最終宛先が「自分自身」である転びは、宛先リストという装置の論理的な帰結であり、前提が必然的に要求する結末を実現している。新奇さが装飾に留まっていない。",
      "judgment": "逸脱（というより前提の比喩）は作品の意味に必然的に働いている。ただしこれは構造の逸脱の意味性ではなく、前提の一貫性の意味性。"
    }
  },
  "value_vector_contribution": {
    "narrative_originality": 45,
    "quality": null,
    "emotional_power": null,
    "plot_architecture": null,
    "character_depth": null,
    "prose_style": null,
    "theme_resonance": null,
    "world_building": null,
    "narrative_technique": null,
    "reader_experience": null
  },
  "classification": "current_success",
  "confidence": 82,
  "strengths": [
    "「スクリーンタイム＝宛先ごとの預けた時間の領収書」という前提の比喩が、構造に一貫して効いている。返すと宛先リストが空き、精霊が薄くなる——返却機構がプロットを駆動しており、前提と形式が部分的に一致している（グリーンフラグ）。",
    "最終宛先が「自分自身」であること。最初の身に覚えのない記録が自分宛てのメッセージだったという輪の閉じ方は、宛先リストという装置の論理的な帰結であり、最も計算された構造的ターン。",
    "既読無視・打っては消す・「どうせ」といったSNS時代の行動様式が、時間の預託という物語機械に丁寧に結線されており、比喩が浮いていない。"
  ],
  "weaknesses": [
    "語りの構造は完全にジャンル標準。時系列・三人称限定・各話クリフハンガー・開示→返済→別れの弧——形式の逸脱はゼロに等しい。",
    "「霊体→正体開示→情緒的回復」の骨格は、スマホを取り巻く現代ファンタジーの流行型をなぞるだけで、変形していない。設定を新しく装っても、構造は既知のヒーリング型のまま（見せかけの新しさのレッドフラグ）。",
    "新奇要素は「設定」の層に集中し、「語り」の層に及んでいない。語り直し・時間の扱い・視点の配置に新しいものは何もない。"
  ],
  "unique_perspective": "この作品が本当に新しいのは「スクリーンタイムが領収書」という見立てではなく、宛先リストという「減っていく一覧」を物語の骨格にした点にある。しかし形式鑑定人としては、それは構造の逸脱ではなく前提の逸脱だ。新しい比喩が古い弧を飾っている——その比喩が美しいからこそ、弧が古いことが見えにくくなっている。第12話の「また明日」という結びは、午前二時という時間的枠の再利用だが、形式を揺るがすほどではない。",
  "red_flags_triggered": [
    "見せかけの新しさ（設定・用語は新しいが構造は既知のヒーリング型のまま）",
    "流行の追従（スマホ/SNS霊・時間の実体化という現代ファンタジーの流行形をなぞる）"
  ],
  "green_flags_detected": [
    "前提と形式の部分的一致（宛先リストの減少＝精霊の減衰という機構の一貫性）"
  ],
  "improvement_suggestions": [
    "第7・8話の開示（約1100字台）の圧縮は、形式の観点では問題ない。開示は長さではなく精度で成立する。ただし「ニジ＝受け取られなかった感情の結晶」という核心的再解釈は、この密度では読者への前提の再負荷が高い。これは形式の評価者の領分を越えるが、「開示の短さ」よりも「開示の準備（第4話〜6話での感情の伏線の張り方）」の方が効いており、設計評価者の判断に委ねたい。"
  ],
  "expected_disagreement_points": [
    {
      "evaluator_type": "anti-generic-story-filter",
      "predicted_stance": "「SNS霊が社会不安を癒す」弧は月並み型に近いと指摘する可能性が高い。ただし領収書比喩の統合度により、完全な月並み判定は回避されると予測する。"
    },
    {
      "evaluator_type": "plot-architecture",
      "predicted_stance": "第7・8話の開示の短さ（約1100字）を設計上の問題と見る可能性がある。私は形式としては許容範囲と見る——開示は長さではなく精度で成立する。"
    },
    {
      "evaluator_type": "reader-experience",
      "predicted_stance": "感情的熱量と「時間は無駄じゃなかった」という主題の届き方は高く評価される可能性が高い。"
    }
  ],
  "narrative": "形式を特定すれば、これは現代ファンタジー・ヒーリング型の忠実な実行である。時系列・三人称限定・各話「続く」のクリフハンガー・開示→返済→別れの弧——語りの構造に逸脱はない。芯になるのは「スクリーンタイム＝誰かに預けた時間の領収書」という前提の比喩だ。この比喩は物語の機械として一貫しており、返すと宛先リストが空き、精霊が薄くなる。そして最終宛先が「自分自身」である転びは、宛先リストという装置の論理的な帰結であり、この作品で唯一、構造的な必然性を感じさせるターンだ。\n\nだが、それは前提の逸脱であって形式の逸脱ではない。新しい比喩が、古い弧を飾っている。既読無視の後輩・言えなかった「ありがとう」・「どうせ」と呟く自己卑下・密かに見ていた先輩——これらはすべてジャンルの標準装備であり、スマホ霊ものの流行型をなぞるだけで変形していない。設定を新しく装った焼き直し、とまでは言わない。領収書の比喩の統合度は本物で、この比喩が作品を月並みの水準から引き上げている。しかし形式鑑定人としての答えは明確だ。この物語の形式は、既存パターンから意味ある形では逸脱していない。",
  "evaluation_timestamp": "2026-08-22T00:00:00Z"
}