{
  "evaluator_id": "character-role",
  "evaluator_name": "Character Role Evaluator",
  "content_summary": "退職間際の看護師が、二十年前に自身の字で改ざんされた観察記録を発見し、病棟の制止を押し切って追跡し、退職の日に記録を当時の医師へ差し出して去る物語。",
  "domain": "pure-literature",
  "content_type": "text",
  "primary_score": 56,
  "primary_score_rationale": "賭けは因果に接続され、人物は一貫した動き方で物語を動かすが、挑戦の抵抗が薄く、行動の代償が実現されないため、本物の自律的行為者の手前に留まる。",
  "dimension_scores": {
    "stake": {
      "score": 52,
      "weight": 0.25,
      "evidence": "本人の書き直した字が二十年前の改ざん記録の中にあり、静かな退職という出口を手放すことでしか落ち着かない構造。取り除けば物語が成立しない。",
      "judgment": "賭けは実在するが、失い得る具体的対象が内的な清算と静かな退職に留まり、物語上で代価として名指しされない。"
    },
    "challenge": {
      "score": 38,
      "weight": 0.15,
      "evidence": "立ち向かう相手（改ざんの当事者、病棟の壁、夜に記録へ触れる第三者）は配置されるが、場面上の抵抗は口頭の制止と記録の位置ずれに限られ、相手が行動で対抗しない。",
      "judgment": "挑戦は存在するが抵抗の段階が弱く、向かう側が本気で闘わないため攻める面が痩せている。"
    },
    "consistency": {
      "score": 68,
      "weight": 0.20,
      "evidence": "抑圧に「何も言わなかった」、退場口に「戻さなかった」と応じ、最終行為も無言の礼と記録の提示で自己完結する。場面を越えて同じ動き方をする。",
      "judgment": "背景（慎重で寡黙な看護師）とロール（沈黙の追及者）が一致し、動きに予測可能な一貫がある。"
    },
    "autonomy": {
      "score": 62,
      "weight": 0.25,
      "evidence": "発見以降の追跡・拒絶・結末はすべて本人の選択で生まれ、物語は退場口（記録を戻して静かに去る）を明示しつつ、それを断ることで次の出来事を発生させる。",
      "judgment": "自律的に物語を動かし物語を変える選択をしているが、代償が実現されず、リスクテイクの覚悟はあっても犠牲の実証がない。"
    },
    "fusion": {
      "score": 56,
      "weight": 0.15,
      "evidence": "役割（沈黙の証人・追及者）は本人の罪悪と過去の偽装への関与から自然に生じ、実際に行動へ移る。",
      "judgment": "機能が傷・欲求の発現であり、動く記号でも静止像でもなく両者が接している。ただし動きの強度は挑戦の弱さに制約される。"
    }
  },
  "value_vector_contribution": {
    "narrative_originality": null,
    "quality": null,
    "emotional_power": null,
    "plot_architecture": null,
    "character_depth": null,
    "character_role": 56,
    "prose_style": null,
    "theme_resonance": null,
    "world_building": null,
    "narrative_technique": null,
    "reader_experience": null,
    "admiration": null,
    "hook": null
  },
  "classification": "current_success",
  "confidence": 70,
  "strengths": [
    "賭けが因果に接続されている——本人の書き直した字が二十年前の改ざん記録の中にあり、私的な気分でなく物語の出来事そのものが罪を暴く。",
    "動きが一貫している——抑圧に「何も言わなかった」、退場口に「戻さなかった」と応じ、最後も無言の礼で自己完結する。予測できて腑に落ちる。",
    "自律的な結末である——退職して静かに去る選択肢を物語が明示した上で、それを断り、記録を机に置く行為へ進む。選択が結末を生んでいる。"
  ],
  "weaknesses": [
    "挑戦の抵抗が薄い——向かう相手はいるが、場面で本気の対抗をせず、制止は言葉だけで、狙われている気配も記録の位置ずれに留まる。",
    "犠牲が実証されない——行動の代償は脅されるだけで実現を見ず、もともと退職する身であるため、リスクテイクが失うものを実際に示さない。",
    "賭けの対象が内面に留まる——失い得るものが内的な清算と静かな退職に限定され、外的・具体的な代価として名指しされない。"
  ],
  "unique_perspective": "動きの狩人として見るなら、この人物の能動の原理は「押し返す」ことではなく「退かない」ことにある。場面4が「戻さなかった」という否定形でしか選択を描かず、場面5も深々と頭を下げるだけの無言の行為でしか抵抗を描かない。だからこそ、挑戦軸の弱さ——向こう側が本気で闘わないこと——が、自律性をそのまま痩せさせている。これは「敵の抵抗なき行為者」という、珍しいが片足だけで立った構図である。",
  "expected_disagreement_points": [
    {
      "evaluator_type": "character-depth",
      "predicted_stance": "内面の罪悪と道徳的負債を高く評価し、深さを称賛すると予測。ただし深井戸の豊かさは動きの強度と直交し、挑戦の薄さは見ない。"
    },
    {
      "evaluator_type": "plot-architecture",
      "predicted_stance": "因果の発端は偶然（記録の発見）に負い、敵対者の抵抗が乏しいため終盤の駆動が弱いと低くつける可能性。私の見方ではこれは挑戦軸の欠損であり、視点は一致し得る。"
    }
  ],
  "green_flags_detected": [
    "取り除いたら失われる",
    "賭けが因果に接続",
    "動きが一貫",
    "機能が傷・欲求の発現"
  ],
  "improvement_suggestions": [
    "挑戦に抵抗の段階を加える——追及に対し相手側が具体的な妨害・恫喝・剥奪で応じる場面を増やし、賭けが実際に脅かされる手応えを与える。",
    "行動の代償を一つ実現させる——記録を差し出した結果、何かを実際に失う・奪われる場面を加え、リスクテイクを実証する。",
    "賭けの対象を具体化する——内的な清算だけでなく、失うに見合う具体的なもの（信頼・関係・安全）を名指しする。"
  ],
  "narrative": "動きの狩人として見れば、水野という人物が物語を自分の手に引き受けたのは、場面4の一行である。「水野は、引き出しに手をかけた。戻さなかった。」ここでプロットは彼女に退場口を差し出している——記録を戻せば静かに退職できる、と。彼女がそれを断った瞬間、物語の次の出来事は彼女の選択から生まれた。場面5で外科部長の机に記録を置く行為は、プロットが運んだ報酬ではなく、彼女が支払った賭けである。これは駒ではない。\n\nしかし狩人として見逃せないのは、挑戦の薄さである。立ち向かう相手はいる——外科部長、それを覆う病棟の壁、夜に記録へ触れる誰か。だが「向こう側」はほとんど抵抗しない。師長の「打ち切りです」は言葉だけの抑止であり、外科部長は黙って見ているだけで、何ひとつ彼女の前に立って闘わない。賭けは本物だが、それを脅かす手が、場面の上で具体的に動かない。彼女は、ほとんど抵抗しない敵に向かって行動する、片足で立った行為者である。\n\n賭けの接続は見事だ。彼女自身の書き直した字が、二十年前の改ざん記録の中にある——私的な後悔ではなく、因果の網に埋め込まれた罪。これを取り除けば物語は消える。ただ、その賭けが支払うべき代償は示されない。彼女はもともと退職する身であり、行動の「代償」は脅されるだけで実現を見ない。リスクテイクの覚悟はあるが、犠牲の実証はされていない。深さと動きが接する融合は悪くないが、動きの強度は挑戦の弱さに引きずられ、最終的に五十半ばに留まる。"
}
