{"evaluator_id":"character-role","evaluator_name":"Character Role Evaluator","content_summary":"倒産寸前の会社を支える看板製品に欠陥が見つかり、品質管理主任の守谷が十年前の自らの見逃しに向き合い、会社と引き換えにリコールを選んで行動する物語。","domain":"genre-fiction","content_type":"text","primary_score":83,"primary_score_rationale":"賭け（会社・父の工場・従業員の生活）が実在し、挑戦（銀行・取引先・自らの過去）も具体的。選択に代償が伴い、その動きが物語を生む自律的行為者。ただし挑戦の具体的な「向こう側」はやや拡散している。","dimension_scores":{"stake":{"score":86,"weight":0.25,"evidence":"欠陥を公にすれば会社は倒産し、従業員の給料と父が築いた工場を失う。黙っていれば会社はもう少し持つ。失うものが人物固有の面として明確に掛かっている。","judgment":"取り除いたら物語が成立しないほど賭けが本物。守谷固有の過去（十年前の見逃し）が痛みをさらに増幅する。"},"challenge":{"score":70,"weight":0.15,"evidence":"銀行の電話（手形が落ちない）、取引先役員の嘲笑（潰れるよ）、出荷を止めない内面の誘惑、十年前の見逃し。賭けは具体的な脅し手にさらされている。","judgment":"立ち向かう対象は存在するが、明確な敵役ではなく複数の圧力に分散し、一部は内省に溶けている。"},"consistency":{"score":84,"weight":0.2,"evidence":"胸ポケットに入れる初動から『止める』の一言、取引先を回り、黙って工場の門を開け、記者会見で自らの見逃しを語るまで、判断の筋が一貫している。","judgment":"場面が変わってもその人らしさが保たれ、即興やプロットの都合ではなく能動の原理で動いている。"},"autonomy":{"score":88,"weight":0.25,"evidence":"守谷の『止める』の選択が以降の展開（取引先回り・リコール・記者会見）を生む。会社と引き換えにリコールを選ぶ代償のある賭けを、自分から踏み出す。","judgment":"出来事への反応ではなく、選択が物語を前に動かす。犠牲を伴うリスクテイクが自律性を証明する。"},"fusion":{"score":84,"weight":0.15,"evidence":"主人公という機能が、『父の工場として、ものづくりとして許せない』という傷・矜持から自然に生まれ、それが実際にリコールという行動に結実している。","judgment":"動く記号ではなく、背景が行動を生む。深さとロールが行動の一点で接合している。"}},"value_vector_contribution":{"narrative_originality":null,"quality":null,"emotional_power":null,"plot_architecture":null,"character_depth":null,"character_role":83,"prose_style":null,"theme_resonance":null,"world_building":null,"narrative_technique":null,"reader_experience":null,"admiration":null,"hook":null},"classification":"current_success","confidence":82,"strengths":["犠牲を伴う選択：リコールを選べば倒産と分かった上で『止める』と宣言し、会社を犠牲にするリスクテイクが賭けの本物さを証明する。","賭けが因果に接続：欠陥の発覚から出荷停止、手形、リコール、記者会見まで、物語の出来事が実際に賭けを脅かす。","動きが一貫：胸ポケット、『止める』、工場の門を開ける、記者会見と、場面を越えて守谷らしい判断が連続する。","機能が傷・欲求の発現：十年前の見逃しという傷が、『ものづくりとして許せない』という矜持を経て行動原理になっている。"],"weaknesses":["挑戦の向こう側が拡散：銀行の電話や取引先役員の嘲笑は圧力だが、意志を持つ敵役としては弱く、闘いの対象が部分的に内省へ溶けている。","選ばざるを得ない状況の提示が進行形で、能動性の検証（拒否すればどう転ぶか）の具体が薄い。"],"unique_perspective":"深い人物かどうかを問わず、この作品の価値は『動く』一点にある。胸ポケットに報告書を入れる動作が、引き出し（隠す）から胸（抱える・引き受ける）への移行として、賭けを行動に接続する瞬間を指し示している。","expected_disagreement_points":[{"evaluator_type":"character-depth","predicted_stance":"内面の葛藤は描かれるが変化弧が薄く、心理の豊かさとしては物足りないと低く見積もる可能性がある。"},{"evaluator_type":"plot-architecture","predicted_stance":"単一の道徳的決断に収斂する因果で、機構としての複雑さには欠けると低く見積もる可能性がある。"}],"green_flags_detected":["犠牲を伴う選択","取り除いたら失われる","賭けが因果に接続","動きが一貫","機能が傷・欲求の発現"],"narrative":"動きの狩人として見ると、守谷は駒ではない。倒産寸前の会社と看板製品の欠陥という与えられた状況のなかで、彼は報告書を机の引き出しではなく胸ポケットに入れる。この一点の所作が、賭けを隠す存在から引き受ける存在へ彼を移す。","evaluation_timestamp":"2026-08-20T00:00:00Z"}
