{"evaluator_id":"character-role","evaluator_name":"Character Role Evaluator","content_summary":"いじめを隠蔽する学校に立ち向かい、担任としての立場と信用を犠牲にして教え子を守る教師の選択と異動の結末を描くプロット。","domain":"genre-fiction","primary_score":82,"primary_score_rationale":"賭け・挑戦・自律性・融合が構造的に揃い、犠牲を伴う選択が物語の結末自体を生み出しており、自律的行為者として成立している。","dimension_scores":{"stake":{"score":88,"weight":0.25,"evidence":"担任としての信用、学校内で積み上げた立場、昇進の道という具体的な損失対象が、守るべき教え子と対置されている。この人物を取り除けば交換の構造そのものが消える。","judgment":"賭けは本物。失い得るものが複数、本人固有に接続されており、取り除いたら失われる条件を満たす。"},"challenge":{"score":85,"weight":0.15,"evidence":"学校の隠蔽と圧力という明確な向こう側が存在し、賭けがその対象によって実際に脅かされる構造になっている。","judgment":"挑戦は実在する。向かう先のない不安ではなく、立ち向かうべき具体的な障壁がある。"},"consistency":{"score":75,"weight":0.20,"evidence":"担任＝守る者という動きの原理が、気づきから調査・告発・異動の受容まで一貫して貫くと読める。場面レベルの揺らぎは要約では検証しきれない。","judgment":"動きの一致は高いが、散文の場面が不在のため、プロット要約の範囲内での構造的な一貫性にとどまる。"},"autonomy":{"score":86,"weight":0.25,"evidence":"自ら調査を進め、学校の圧力に抗し、いじめを明るみに出すという選択が後続の出来事（いじめの沈静、異動）を生んでいる。代償を承知で踏み出すリスクテイクが明示されている。","judgment":"出来事への反応ではなく、出来事を生む選択。犠牲を伴う行動が結末自体を意味づけており、自律性が高い。"},"fusion":{"score":82,"weight":0.15,"evidence":"主人公という機能が担任の職責と守るべき対象への責務の自然な発現であり、同時に実際の行動として実現している。貼り付けたラベルではなく、傷・欲求から動いている。","judgment":"機能と人が噛み合い、動く記号でも静止像でもない。ただし内面の揺れの記述が薄く、人の肉付けは要約では十分に検証できない。"}},"value_vector_contribution":{"narrative_originality":null,"quality":null,"emotional_power":null,"plot_architecture":null,"character_depth":null,"character_role":82,"prose_style":null,"theme_resonance":null,"world_building":null,"narrative_technique":null,"reader_experience":null,"admiration":null,"hook":null},"classification":"current_success","confidence":78,"strengths":["賭けが具体的（担任としての信用・立場・昇進の道）で、取り除けば物語の交換構造が成立しない。","学校の隠蔽という明確な挑戦対象に対して賭けが因果的に接続されている。","自力で調査を進め、異動という代償を引き受ける自律的なリスクテイクが結末を生んでいる。","主人公という機能が担任＝守る者という責務の自然な発現として、実際の行動に具現している。"],"weaknesses":["プロット要約のみで場面が不在のため、動きの一致を構造的にしか検証できず、散文での揺らぎの有無は未確認。","挑戦対象である学校の圧力が単一の記号（隠蔽）に集約され、向こう側の厚みや具体的な敵役の手応えが薄い可能性がある。","内面の躊躇や葛藤の過程が記述されず、犠牲が結論として提示されるため、能動の原理の肉付けがやや弱い。"],"unique_perspective":"このプロットの核は「救うこと」ではなく「失うものとの交換」にある。学校に抗うのではなく、自分の立場と信用を引換に生徒を選ぶ交換の構造が、賭け（守る面）と挑戦（攻める面）の対として過不足なく噛み合っている。異動という結末が罰ではなく本人の意志による選択として提示されている点こそが、この人物を駒ではなく行為者にしている。","expected_disagreement_points":[{"evaluator_type":"character-depth","predicted_stance":"内面葛藤や変化弧の具体的な描写が薄く、深さの軸では低く評価される可能性が高い。"},{"evaluator_type":"plot-architecture","predicted_stance":"因果が単線的で機構としての複雑さは薄く、プロットの精巧さでは評価を下げる可能性がある。"}],"narrative":"この人物は動いている。担任としての信用と学校内の立場、昇進の道という失い得るものを背負い、学校の隠蔽という明確な向こう側に立ち向かう。賭けと挑戦が対になり、しかもその賭けは私的な気分ではなく、物語の出来事が実際に脅かすものだ。取り除いたら、この物語の交換は成立しない。賭けは本物である。\n\nさらに注目すべきは、彼が反応しているのではないという点だ。学校の圧力が来る前に、自分の意志で調査を進め、明るみに出すことを選ぶ。その選択が後続の出来事を生み、異動という代償を承知で踏み出す。これこそがリスクテイクであり、犠牲を伴う選択が結末自体を意味づけている。\n\nただし、注意すべきはこれがプロット要約であることだ。場面を越えた「らしさ」の微細な一貫性や、踏み出す瞬間の内面の揺れは、ここからは検証できない。構造としては動く人として過不足なく成立しているが、その肉付けが散文でどう実るか、そこにこの評価の残る余地がある。","green_flags_detected":["犠牲を伴う選択","取り除いたら失われる","賭けが因果に接続","動きが一貫","機能が傷・欲求の発現"],"content_type":"plot","evaluation_timestamp":"2026-08-20T00:00:00Z"}
