{"evaluator_id":"character-role","evaluator_name":"Character Role Evaluator","content_summary":"欠陥を見逃した過去を持つ品質管理の主人公が、倒産を承知でリコールを決断するまでを描く短編。","domain":"genre-fiction","content_type":"text","primary_score":70,"primary_score_rationale":"見逃した欠陥への負い目という賭けが実在し、銀行・取引先という具体的な挑戦に立ち向かい、会社の終わりを承知でリコールを決める自律的リスクテイクに到達している。中盤の受動的な相談が長く、人物の厚みも薄いが、駒を超えた行為者として構造上成立している。","dimension_scores":{"stake":{"score":75,"weight":0.25,"evidence":"欠陥製品は倒産寸前の会社を一本で支え、主人公が見逃した過去の過ちが人を傷つける恐れと結びつく。取り除けば会社の存続と道徳的負い目の両方が消える。","judgment":"賭けは実在する。『自分が見逃した欠陥で人を傷つける』という本人固有の負い目が、会社の存続という即物的損失に接続されている。"},"challenge":{"score":65,"weight":0.15,"evidence":"銀行担当者や取引先役員（『潰れるよ』）が具体的外部として決断を押し返し、黙殺すれば使う人が危険にさらされる板挟みが形成される。","judgment":"立ち向かう相手は具体的で、賭けを脅かす『向こう側』として機能している。ただし対抗者としては輪郭が淡く、拮抗の実感は弱い。"},"consistency":{"score":65,"weight":0.20,"evidence":"相談に沈黙で応じる、何も答えない、それでもリコールを決める——場面を越えて『消えない思い』が応答を一貫させている。","judgment":"応答はその人らしく、プロットの都合による揺れは小さい。ただし行動の幅が狭く、一貫性が単調の裏返しにもなっている。"},"autonomy":{"score":72,"weight":0.25,"evidence":"『出荷を止めずにはいられなかった』は、会社の崩壊という代償を承知で踏み出す主体的選択で、以後の記者会見と会社の終わりという結末を生む。","judgment":"選択が出来事を生み、犠牲を伴うリスクテイクとして成立している。ただし決断に至る中盤は相談の積み重ねで、受動的な時間が長い。"},"fusion":{"score":62,"weight":0.15,"evidence":"『見逃した罪悪』という傷が、リコールを宣言する機能へ自然に接続し、機能は内面の延長として動いている。","judgment":"機能が傷の発現であり、実際に行動する。人物の厚みそのものは要約的で薄いが、ロールと人の接続は成立している。"}},"value_vector_contribution":{"narrative_originality":null,"quality":null,"emotional_power":null,"plot_architecture":null,"character_depth":null,"character_role":70,"prose_style":null,"theme_resonance":null,"world_building":null,"narrative_technique":null,"reader_experience":null,"admiration":null,"hook":null},"classification":"current_success","confidence":72,"strengths":["見逃した欠陥への負い目を賭けとして構造化し、会社の存続という即物的損失と結びつけて、賭けを『取り除いたら失われる』ものにしている。","リコール決断が代償（会社の終わり）を伴う主体的選択で、その後の結末を因果として生んでいる。","銀行・取引先という具体的な『向こう側』が提示され、賭けが現実の出来事に脅かされる構造になっている。"],"weaknesses":["中盤が相談と沈黙の繰り返しで、決断に至るまでの受動的な時間が長く、リスクテイクがクライマックス一点に集中している。","行動の幅が狭く、『らしさ』の一貫性が単調さと表裏一体で、場面ごとの機微が薄い。","人物の内面の厚みが薄く、機能に至る傷の描写が要約的で、融合の深さに限界がある。"],"unique_perspective":"この人物の賭けは『会社が潰れるか』ではなく『自分が見逃した欠陥で人を傷つけるか』であり、だからこそ勝敗に失うものがある。リコールは経営判断ではなく、負い目という能動の原理が物語を自分の手に引き受けた瞬間である。","expected_disagreement_points":[{"evaluator_type":"character-depth","predicted_stance":"内面の描写が薄く、良心の呵責が要約に留まるため、『生きている人物』としては物足りないと低く見る可能性が高い。"},{"evaluator_type":"plot-architecture","predicted_stance":"板挟みからリコールへの因果が単線的で、機構としての工夫が少ないため、低めにつける可能性がある。"}],"narrative":"この話の中心には、はっきりした動きの瞬間がある。『出荷を止めずにはいられなかった』——この一行で、主人公はプロットに運ばれる存在であることをやめている。彼を動かしていたのは『自分が見逃した欠陥で人を傷つけてはいけない』という消えない思いで、その思いが最後に、会社の終わりという代償を承知で踏み出させる。","evaluation_timestamp":"2026-08-20T00:00:00Z"}
