{"evaluator_id":"character-role","evaluator_name":"Character Role Evaluator","content_summary":"退職三ヶ月前の医療職が、二十年前の患者記録の食い違いに気づき、周囲の無化と警告を押して県の医療審査会へ届けるまでの静かな闘い。","domain":"genre-fiction","content_type":"text","primary_score":79,"primary_score_rationale":"退職間際という失い得るものを持ち、警告を黙殺して届けるリスクテイクが物語を動かす。賭け・挑戦・一致・自律・融合が構造的に揃った自律的行為者。ただし対抗者本人の不在と、失うものが内面倫理に偏る点が上限を抑える。","dimension_scores":{"stake":{"score":74,"weight":0.25,"evidence":"退職間際の医療職が二十年前の記録の食い違いを追い、止めなければ患者の死がまた二十年眠ったままになるという本人固有の失い得るものが因果に接続されている。","judgment":"取り除けば物語が成立しない点で賭けは本物。ただし実害は小さく、内面の良心に偏るために外部から見た失うものがやや観念的。"},"challenge":{"score":78,"weight":0.15,"evidence":"同僚の「昔のことは、もう」という無化、手がかりの乏しさ、使いの「余計なことはしないほうがいい」という圧力が、具体的な向こう側を形成している。","judgment":"対抗者本人は姿を見せないが、隠蔽へ繋がる組織の気配として明確に立ち向かう対象がある。ただ肉厚は一歩薄い。"},"consistency":{"score":82,"weight":0.20,"evidence":"返答を控え、黙ったまま聞き込みを続け、届ける——場面を越えて「止まれない」という同じ原理で動いている。","judgment":"予測可能かつ腑に落ちる一貫性。プロットの都合で場面ごとに揺れず、能動の原理として読み取れる。"},"autonomy":{"score":82,"weight":0.25,"evidence":"警告を黙殺して審査会へ届ける選択が後の出来事を生み、退職までの円滑な締めを代償にするリスクテイクを含んでいる。","judgment":"出来事への反応ではなく、自らの選択が物語を進める自律的行為。犠牲を伴う選択が賭けの実在を裏打ちする。"},"fusion":{"score":78,"weight":0.15,"evidence":"二十年前の見送りへの消えない思い（傷）が、記録の追及と審査会への届出（機能）として自然に発現し、実際に行動している。","judgment":"背景なきロールでもロールなき背景でもなく、動く人として融合している。"}},"value_vector_contribution":{"narrative_originality":null,"quality":null,"emotional_power":null,"plot_architecture":null,"character_depth":null,"character_role":79,"prose_style":null,"theme_resonance":null,"world_building":null,"narrative_technique":null,"reader_experience":null,"admiration":null,"hook":null},"classification":"current_success","confidence":80,"strengths":["退職間際という失い得るものを持ち、それを取ってまで記録を届ける犠牲を伴う選択が、賭けの実在を証明している。","動きが一貫している。「答えない」こと自体が意思表示であり、沈黙から届出へ同一の原理で運ばれている。","機能が傷の自然な発現である。"],"weaknesses":["挑戦の対抗者が本人として場面に登場せず、使いの一言に留まるため、立ち向かう向こう側の肉厚が薄い。","賭けが私的良心と引退の終え方に偏り、外的な実害が描かれないため、失うものがやや観念的である。","内面の動機が地の文による説明で多く語られ、場面で演じ切られていない面がある。"],"unique_perspective":"この人物の能動は「黙る」という非言語の反復であり、警告への無言こそが最も強い拒否である。返答しないことを傍観と読んでしまうと本質を見誤る。彼女は静かな方法で、しかし確実に物語を手放さない。","expected_disagreement_points":[{"evaluator_type":"character-depth","predicted_stance":"深さ（内面葛藤・変化弧）は薄いと低くつける可能性。動機が説明で済まされ、内的対立が地の文で語られるだけに見えるため。"},{"evaluator_type":"plot-architecture","predicted_stance":"因果の設計は単純で、対抗者不在・調査の偶然性が高いとして機構面を低く評価する可能性。"}],"narrative":"この人物は、ロッカーの整理という受動の場面から始まりながら、記録の食い違いを「見つけた瞬間」に駒であることをやめている。注目すべきは、彼女の能動の多くが沈黙という非言語のかたちをとっている点だ。彼女は静かな方法で、しかし確実に物語を手放さない。","evaluation_timestamp":"2026-08-20T00:00:00Z"}
