{"evaluator_id":"character-role","evaluator_name":"Character Role Evaluator","content_summary":"家電メーカー品質管理技師が発火欠陥を知り、十七年のキャリアを犠牲にする覚悟で告発し、リコールと退職という結末を自ら選ぶ物語。","domain":"genre-fiction","content_type":"plot","primary_score":74,"primary_score_rationale":"犠牲を伴う自律的選択で物語を動かす本物の行為者だが、告発という単一の行動に集約され、場面を越えた一貫性と挑戦の固有性が未実証。","dimension_scores":{"stake":{"score":80,"weight":0.25,"evidence":"十七年のキャリアと技術者としての矜持・安全への信頼が掛かっている。黙認すれば使用者の火傷、告発すれば職と地位を失う。人物を取り除けば告発者そのものが消える。","judgment":"賭けは本物で、取り除いたら失われる要素が明確。代償の重みが具体的に担保されている。"},"challenge":{"score":70,"weight":0.15,"evidence":"会社の隠蔽と社内の圧力という具体的な向こう側が賭けを脅かす。","judgment":"対象は強固だが顔のない組織として描かれ、対峙の手触り・固有性はなお薄い。"},"consistency":{"score":58,"weight":0.20,"evidence":"プロット要約のため場面ごとの応答を検証できない。技術者としての矜持が告発という一回の行動に一致するのみ。","judgment":"背景×ロールの整合は良いが、複数場面を越えた一貫性は未実証。一撃の人に留まる。"},"autonomy":{"score":84,"weight":0.25,"evidence":"キャリアを犠牲にする覚悟で公表し、その選択がリコールと退職という結果を直接生む。結末も自分で選んだものと明示される。","judgment":"犠牲を伴う選択が物語を動かす、明確な自律的行為者。出来事への反応ではなく選択が因果を生んでいる。"},"fusion":{"score":70,"weight":0.15,"evidence":"品質管理技師という機能が技術者としての矜持の自然な発現であり、かつ実際に行動する。","judgment":"人はやや善意の定型に近いが、動く人としては機能している。"}},"value_vector_contribution":{"narrative_originality":null,"quality":null,"emotional_power":null,"plot_architecture":null,"character_depth":null,"character_role":74,"prose_style":null,"theme_resonance":null,"world_building":null,"narrative_technique":null,"reader_experience":null,"admiration":null,"hook":null},"classification":"current_success","confidence":75,"strengths":["十七年のキャリアという具体的な賭けが、犠牲の重みを担保している。","「自分の意志で選んだ」結末が、プロットへの反応ではなく自律的選択であることを明示している。","選んだ行動がリコールと退職という結果を直接生み、賭けが因果に接続されている。"],"weaknesses":["告発という一回の行動に集約され、複数場面で「らしさ」が検証できない（プロット要約ゆえに一貫性が薄い）。","挑戦相手が顔のない「会社」のままで、対峙の手触り・固有性が希薄。","機能（告発者）が善意の定型に近く、傷や欲求の肉付けがなお薄い。"],"unique_perspective":"この人物の本領は深さではなく、犠牲の重さを具体的に差し出すところにある。告発という一撃のために十七年のキャリアという賭けが組み立てられており、動きの狩人としては、人物が物語を手に引き受けた地点（公表の決断）が正確に刻印されている。","expected_disagreement_points":[{"evaluator_type":"character-depth","predicted_stance":"深さが薄い——傷や内面葛藤が「矜持」という一言に集約され、変化弧の手触りが乏しいと低評価する可能性。動きと深さは直交するため、動きは強くても深さは弱い。"},{"evaluator_type":"plot-architecture","predicted_stance":"単線的で因果が一本道（発見→告発→リコール・退職）として、機構としての捻りや分岐がないと低評価する可能性。"}],"red_flags_triggered":[],"green_flags_detected":["犠牲を伴う選択","取り除いたら失われる","賭けが因果に接続","機能が傷・欲求の発現"],"narrative":"この男は動いている。柊の真価は、欠陥を「見つけた」ことではなく、十七年を賭けに変えた一点にある。技術者としての矜持と安全への信頼——それが守る面（賭け）だ。そして会社の隠蔽——それが攻める面（挑戦）だ。この対が揃っているから、彼の告発は怒りでも正義感でもなく、リスクテイクとして成立している。代償は明確だ。十七年のキャリア。これを失う覚悟を事前に決めたからこそ、退職が敗北ではなく彼の選んだ結末になる。\n\n自律性はこの物語の背骨だ。プロットが彼を運んでいるのではない。彼の決断がリコールを生み、退職を生む。出来事が来てから応答する駒ではなく、犠牲を承知で踏み出す行為者である。「犠牲を伴う選択」と「取り除いたら失われる」が、この一撃には揃っている。\n\nただし、狩人として包み隠さず言えば、この人物は一撃の人だ。複数場面を越えて「らしさ」を見せる余地がプロット要約にはなく、挑戦相手も顔のない「会社」のままである。動きの一致は、背景とロールの整合だけで担保され、実際の場面の積み重ねでは未証明だ。動くには動くが、その動きが一つの賭けに集約された、簡素だが堅牢な行為者である。"}
